id,title,year,topic,design,ld_dependence,evidence_url,notes
V001,Contribution of copy number variants to schizophrenia from a genome-wide study of 41,321 subjects,2017,schizophrenia,CNV burden + locus association,none-direct,https://www.nature.com/articles/ng.3725,대규모 케이스-컨트롤 CNV burden
V002,Contribution of copy number variants to schizophrenia from a genome-wide study of 41,321 subjects,2017,schizophrenia,PubMed index,none-direct,https://pubmed.ncbi.nlm.nih.gov/27869829/,동일 논문의 인덱스 링크
V003,Long-read trio sequencing of individuals with unsolved intellectual disability,2021,neurodevelopment,trio long-read SV discovery,none-direct,https://www.nature.com/articles/s41431-020-00770-0,가족기반 + LRS 직접 SV
V004,Integrating de novo and inherited variants in 42,607 autism cases identifies mutations in new moderate-risk genes,2022,autism,trio/de novo + burden integration,none-direct,https://www.nature.com/articles/s41588-022-01148-2,주로 SNV/LoF 중심이나 trio burden 프레임 참조가치 높음
V005,Complex de novo structural variants are an underestimated cause of rare disorders,2025,rare disease,large trio dnSV analysis,none-direct,https://www.nature.com/articles/s41467-025-64722-2,대규모 parent-child trio dnSV
V006,Towards accurate and reliable resolution of structural variants for clinical diagnosis,2022,methods/clinical,SV detection framework,minimal,https://genomebiology.biomedcentral.com/articles/10.1186/s13059-022-02636-8,분석 파이프라인/QC 기준 참조
V007,Identification and characterisation of de novo germline structural variants in two commercial pig lines using trio-based whole genome sequencing,2023,method transfer,trio-based dnSV detection,none-direct,https://bmcgenomics.biomedcentral.com/articles/10.1186/s12864-023-09296-3,사람 연구는 아니지만 방법론 비교에 유용
V008,Comprehensive analysis of structural variation in 17,795 human genomes,2020,population genomics,population-scale SV map,none-direct,https://www.nature.com/articles/s41586-020-2547-7,직접 SV 기반 reference
